{
  "candidate": "alpha-continuity-drill-20260716c",
  "channel": "alpha",
  "components": {
    "cli": {
      "commit": "9aafb87f2432cba0be9ed21e4e509cb9b6acda5d",
      "version": "0.1.92"
    },
    "sdk-php": {
      "commit": "05fe99b44062b939e4c43acc00dae457eef87af2",
      "version": "0.1.9"
    },
    "sdk-python": {
      "commit": "8aa0e86fe51edc1e7aba3d97ddf3dfda8009ee23",
      "version": "0.4.101"
    },
    "sdk-rust": {
      "commit": "31e87f4aa13a7fd255fd277a62c43c96ee1532ab",
      "version": "0.1.16"
    },
    "server": {
      "commit": "ffa5bf5e0d68a032550451dc31073cc83c25fc52",
      "version": "0.2.666"
    },
    "waterline": {
      "commit": "60b2de727e27cc17fcb611b3650e0c100968547b",
      "version": "2.0.0-alpha.136"
    },
    "workflow": {
      "commit": "54320e6687d7028dfb625152a864ba218e125afe",
      "version": "2.0.0-alpha.289"
    }
  },
  "release_plan": {
    "commit": "8af123bdb8b973d9b750f273de8114351b17a47f",
    "sha256": "486d9ef7c5a7f4443a89566cab33d7f2bccc518254ab6698d918a431d6a1c9ce",
    "tag": "release-plan/alpha-continuity-drill-20260716c"
  },
  "schema": "durable-workflow.release-candidate/v1"
}
